{
  "schema_version": "mainframe-env.dataset-programming-surface@1",
  "target_subsystem": "dataset.data",
  "baseline_id": "ibm-zos-3.2-dfsms-ams-2026-06",
  "source": {
    "publication": "SC23-6846-70",
    "url": "https://www.ibm.com/docs/api/v1/toc/SSLTBW_3.2.0?lang=en",
    "manifest": "conformance/subsystems/coverage/manifests/dataset-vsam-ams-topics.json",
    "sha256": "sha256:a1798761a230fbcdf0c772900c28f3656bb04b6a9210bc4b782c2aeeffafbdc1",
    "bytes": 3448164,
    "snapshot_date": "2026-06-22"
  },
  "state_schema_version": 6,
  "families": [
    {
      "id": "organizations",
      "items": [
        {"id":"sequential","label":"Sequential data set","authority":"dataset","implementation":"required","operands":["PS"],"effect":"Stores records in deterministic sequential order.","official_rows":[]},
        {"id":"pds","label":"Partitioned data set","authority":"dataset","implementation":"required","operands":["PO"],"effect":"Owns a bounded member directory and member record streams.","official_rows":[]},
        {"id":"pdse","label":"Partitioned data set extended","authority":"dataset","implementation":"required","operands":["PO-E"],"effect":"Owns PDSE members, generations, aliases, and program-object metadata.","official_rows":[]},
        {"id":"ksds","label":"Key-sequenced data set","authority":"dataset","implementation":"required","operands":["INDEXED","KEYS"],"effect":"Orders unique primary keys and atomically maintains alternate indexes.","official_rows":["ibm-zos-3.2-dfsms-ams-2026-06:vsam-primary-organizations:0002"]},
        {"id":"esds","label":"Entry-sequenced data set","authority":"dataset","implementation":"required","operands":["NONINDEXED"],"effect":"Preserves arrival order and stable relative byte addresses.","official_rows":["ibm-zos-3.2-dfsms-ams-2026-06:vsam-primary-organizations:0001"]},
        {"id":"fixed-rrds","label":"Fixed relative record data set","authority":"dataset","implementation":"required","operands":["NUMBERED"],"effect":"Maps fixed slots to one-based relative record numbers.","official_rows":["ibm-zos-3.2-dfsms-ams-2026-06:vsam-primary-organizations:0004"]},
        {"id":"variable-rrds","label":"Variable relative record data set","authority":"dataset","implementation":"required","operands":["NUMBERED","RECORDSIZE"],"effect":"Maps variable-length records to one-based relative record numbers.","official_rows":["ibm-zos-3.2-dfsms-ams-2026-06:vsam-primary-organizations:0005"]},
        {"id":"lds","label":"Linear data set","authority":"dataset","implementation":"required","operands":["LINEAR"],"effect":"Exposes bounded byte ranges without record interpretation.","official_rows":["ibm-zos-3.2-dfsms-ams-2026-06:vsam-primary-organizations:0003"]},
        {"id":"gdg","label":"Generation data group","authority":"catalog","implementation":"required","operands":["GENERATIONDATAGROUP","LIMIT","EMPTY","SCRATCH"],"effect":"Selects and rolls deterministic absolute and relative generations.","official_rows":[]},
        {"id":"alias","label":"Catalog alias","authority":"catalog","implementation":"required","operands":["ALIAS","RELATE"],"effect":"Resolves an alternate catalog name through the shared dependency graph.","official_rows":[]},
        {"id":"user-catalog","label":"User catalog","authority":"catalog","implementation":"required","operands":["USERCATALOG"],"effect":"Owns a bounded catalog namespace selected by catalog search order.","official_rows":[]},
        {"id":"master-catalog","label":"Master catalog","authority":"catalog","implementation":"required","operands":["MASTERCATALOG"],"effect":"Owns the root catalog namespace and user-catalog connectors.","official_rows":[]}
      ]
    },
    {
      "id": "access-modes",
      "items": [
        {"id":"key","label":"Key access","authority":"dataset","implementation":"required","operands":["KEY","GENERIC"],"effect":"Locates exact or generic primary and alternate keys.","official_rows":[]},
        {"id":"rba","label":"Relative byte address access","authority":"dataset","implementation":"required","operands":["RBA"],"effect":"Reads and positions ESDS or LDS content by stable byte address.","official_rows":[]},
        {"id":"rrn","label":"Relative record number access","authority":"dataset","implementation":"required","operands":["RRN"],"effect":"Reads and mutates RRDS slots by one-based record number.","official_rows":[]},
        {"id":"sequential-access","label":"Sequential access","authority":"dataset","implementation":"required","operands":["SKIP","COUNT"],"effect":"Reads deterministic forward or reverse record sequences.","official_rows":[]},
        {"id":"member","label":"Partitioned member access","authority":"dataset","implementation":"required","operands":["MEMBER","ALIAS"],"effect":"Resolves members, member generations, and aliases within one directory authority.","official_rows":[]}
      ]
    },
    {
      "id": "dcb",
      "items": [
        {"id":"dsorg","label":"Data set organization","authority":"dataset","implementation":"required","operands":["DSORG"],"effect":"Selects an owned organization with organization-specific invariants.","official_rows":[]},
        {"id":"recfm","label":"Record format","authority":"dataset","implementation":"required","operands":["RECFM"],"effect":"Selects F, FB, FBS, V, VB, VS, VBS, or U record validation.","official_rows":[]},
        {"id":"lrecl","label":"Logical record length","authority":"dataset","implementation":"required","operands":["LRECL","RECORDSIZE"],"effect":"Bounds logical record bytes and fixed-record exact length.","official_rows":[]},
        {"id":"blksize","label":"Block size","authority":"dataset","implementation":"required","operands":["BLKSIZE"],"effect":"Controls deterministic block allocation and validates fixed blocking.","official_rows":[]},
        {"id":"keylen","label":"Primary key length","authority":"dataset","implementation":"required","operands":["KEYLEN","KEYS"],"effect":"Selects the bounded key slice used by keyed access.","official_rows":[]},
        {"id":"keyoff","label":"Primary key offset","authority":"dataset","implementation":"required","operands":["KEYOFF","KEYS"],"effect":"Selects the zero-based key displacement within each record.","official_rows":[]},
        {"id":"ccsid","label":"Coded character set","authority":"dataset","implementation":"required","operands":["CCSID"],"effect":"Records the data encoding identity used at text conversion boundaries.","official_rows":[]},
        {"id":"bufno","label":"Buffer count","authority":"dataset","implementation":"required","operands":["BUFNO"],"effect":"Bounds the provider buffer reservation requested by the caller.","official_rows":[]},
        {"id":"bufsize","label":"Buffer size","authority":"dataset","implementation":"required","operands":["BUFSIZE"],"effect":"Bounds each logical access buffer without changing record bytes.","official_rows":[]},
        {"id":"spanned","label":"Spanned records","authority":"dataset","implementation":"required","operands":["SPANNED","VS","VBS"],"effect":"Allows a logical variable record to span control intervals while retaining exact bytes.","official_rows":[]},
        {"id":"undefined","label":"Undefined records","authority":"dataset","implementation":"required","operands":["U"],"effect":"Preserves caller-supplied byte units without fixed or variable length interpretation.","official_rows":[]},
        {"id":"line","label":"Line records","authority":"dataset","implementation":"required","operands":["LINE"],"effect":"Preserves bounded text records without embedded record delimiters.","official_rows":[]}
      ]
    },
    {
      "id": "allocation",
      "items": [
        {"id":"space-unit","label":"Space unit","authority":"allocation","implementation":"required","operands":["TRACKS","CYLINDERS","BLOCKS","KILOBYTES","MEGABYTES","RECORDS"],"effect":"Selects the deterministic unit used to calculate allocated capacity.","official_rows":[]},
        {"id":"primary-space","label":"Primary space","authority":"allocation","implementation":"required","operands":["PRIMARY","SPACE"],"effect":"Reserves the initial bounded allocation before catalog publication.","official_rows":[]},
        {"id":"secondary-space","label":"Secondary space","authority":"allocation","implementation":"required","operands":["SECONDARY"],"effect":"Controls bounded deterministic extension after primary capacity.","official_rows":[]},
        {"id":"directory-space","label":"Directory blocks","authority":"allocation","implementation":"required","operands":["DIRECTORY"],"effect":"Bounds PDS or PDSE directory capacity.","official_rows":[]},
        {"id":"release","label":"Release unused space","authority":"allocation","implementation":"required","operands":["RLSE"],"effect":"Releases unused secondary allocation at lifecycle close.","official_rows":[]},
        {"id":"contiguous","label":"Contiguous allocation","authority":"allocation","implementation":"required","operands":["CONTIG"],"effect":"Requires one deterministic abstract extent or explicit physical capability.","official_rows":[]},
        {"id":"round","label":"Cylinder rounding","authority":"allocation","implementation":"required","operands":["ROUND"],"effect":"Rounds abstract allocation to the deterministic cylinder unit.","official_rows":[]},
        {"id":"unit-count","label":"Unit count","authority":"allocation","implementation":"required","operands":["UNIT"],"effect":"Bounds the number of allocation devices requested.","official_rows":[]},
        {"id":"normal-disp","label":"Normal disposition","authority":"lifecycle","implementation":"required","operands":["CATLG","KEEP","DELETE","PASS"],"effect":"Applies the declared catalog and cleanup action after normal completion.","official_rows":[]},